### ISSUE TITLE
Dishwasher support

### ISSUE THREAD

**Issue by joneshf** [anszom/rethink#35]
Heya! Thanks for putting this together. I'm excited at the idea that there might be a way to get LG appliances to work without LG's cloud.

I've been trying to setup a dishwasher, but not having great luck. I've got `rethink-cloud` running at `rethink-cloud.<my-domain>`. I've got DNS setup to redirect both `common.lgthinq.com` and `rethink-cloud.<my-domain>` to the IP address that's running `rethink-cloud`. The dishwasher is on a separate VLAN with no internet access, but has a firewall rule to connect to `rethink-cloud` over any port/protocol.

I can run this from my computer on that separate VLAN:
```Console
$ curl --insecure https://common.lgthinq.com/route
{"resultCode":"0000","result":{"apiServer":"https://rethink-cloud.<my-domain>:443","mqttServer":"ssl://rethink-cloud.<my-domain>:8883"}}
```
and this from my computer on that separate VLAN:
```Console
$ curl --include --insecure https://rethink-cloud.<my-domain>:443/certificate
HTTP/1.1 200 OK
X-Powered-By: Express
content-type: text/xml;charset=utf-8
Date: Fri, 17 Apr 2026 14:32:11 GMT
Connection: keep-alive
Keep-Alive: timeout=5
Content-Length: 0
```

So the DNS/firewall setup for all this seems to be working from a real computer. But when I follow the steps in https://github.com/anszom/rethink/wiki/Installing-rethink%E2%80%90cloud, the only output I see on the `rethink-cloud` side is:
```
Rethink cloud ready
2026-04-17T14:15:26.963Z status HA mqtt connection established
2026-04-17T14:18:13.621Z HTTPS common.lgthinq.com /route
```

The dishwasher doesn't seem to do anything else after making that request to `common.lgthinq.com/route`. It's like it doesn't like the response or something.

I tried adding in the `httpsServer` field in the response as suggested here: https://github.com/anszom/rethink/issues/9#issuecomment-3649249240, but it doesn't seem to make a difference.

I've tried doing a `tcpdump` on the wireless access point to see if it provided more insight with this command:
```Console
$ tcpdump --interface=any -n -w - -U host 10.10.50.68 | tee dump-with-spaces.pcap | tcpdump -r -
```

And when I run `tshark` on the output, it looks like this:
<details>
<summary>tshark output</summary>

- `10.10.10.64` is the IP address where `rethink-cloud` is running.
- `10.10.50.1` is the IP address of the DHCP/DNS server for the separate VLAN.
- `10.10.50.68` is the IP address of the dishwasher.

```Console
$ tshark --read-file=dump-with-spaces.pcap
    1   0.000000   10.10.50.1 → 10.10.50.68  DHCP 348 DHCP Offer    - Transaction ID 0x35573cde
    2   0.000009   10.10.50.1 → 10.10.50.68  DHCP 348 DHCP Offer    - Transaction ID 0x35573cde
    3   0.000082   10.10.50.1 → 10.10.50.68  DHCP 348 DHCP Offer    - Transaction ID 0x35573cde
    4   0.000087   10.10.50.1 → 10.10.50.68  DHCP 348 DHCP Offer    - Transaction ID 0x35573cde
    5   0.102171   10.10.50.1 → 10.10.50.68  DHCP 348 DHCP ACK      - Transaction ID 0x35573cde
    6   0.102185   10.10.50.1 → 10.10.50.68  DHCP 348 DHCP ACK      - Transaction ID 0x35573cde
    7   0.102306   10.10.50.1 → 10.10.50.68  DHCP 348 DHCP ACK      - Transaction ID 0x35573cde
    8   0.102314   10.10.50.1 → 10.10.50.68  DHCP 348 DHCP ACK      - Transaction ID 0x35573cde
    9   0.283466 LGInnotek_44:55:66 →              ARP 48 Who has 10.10.50.68? (ARP Probe)
   10   0.283483 LGInnotek_44:55:66 →              ARP 48 Who has 10.10.50.68? (ARP Probe)
   11   0.283521 LGInnotek_44:55:66 →              ARP 48 Who has 10.10.50.68? (ARP Probe)
   12   0.283538 LGInnotek_44:55:66 →              ARP 48 Who has 10.10.50.68? (ARP Probe)
   13   0.500848 LGInnotek_44:55:66 →              ARP 48 Who has 10.10.50.68? (ARP Probe)
   14   0.500865 LGInnotek_44:55:66 →              ARP 48 Who has 10.10.50.68? (ARP Probe)
   15   0.500907 LGInnotek_44:55:66 →              ARP 48 Who has 10.10.50.68? (ARP Probe)
   16   0.500926 LGInnotek_44:55:66 →              ARP 48 Who has 10.10.50.68? (ARP Probe)
   17   0.750621 LGInnotek_44:55:66 →              ARP 48 Who has 10.10.50.68? (ARP Probe)
   18   0.750634 LGInnotek_44:55:66 →              ARP 48 Who has 10.10.50.68? (ARP Probe)
   19   0.750657 LGInnotek_44:55:66 →              ARP 48 Who has 10.10.50.68? (ARP Probe)
   20   0.750674 LGInnotek_44:55:66 →              ARP 48 Who has 10.10.50.68? (ARP Probe)
   21   0.752943 LGInnotek_44:55:66 →              ARP 48 ARP Announcement for 10.10.50.68
   22   0.752951 LGInnotek_44:55:66 →              ARP 48 ARP Announcement for 10.10.50.68
   23   0.752981 LGInnotek_44:55:66 →              ARP 48 ARP Announcement for 10.10.50.68
   24   0.752996 LGInnotek_44:55:66 →              ARP 48 ARP Announcement for 10.10.50.68
   25   1.050372  10.10.50.68 → 10.10.50.1   DNS 84 Standard query 0x50ba A common.lgthinq.com
   26   1.050383  10.10.50.68 → 10.10.50.1   DNS 84 Standard query 0x50ba A common.lgthinq.com
   27   1.050508  10.10.50.68 → 10.10.50.1   DNS 84 Standard query 0x50ba A common.lgthinq.com
   28   1.055372   10.10.50.1 → 10.10.50.68  DNS 100 Standard query response 0x50ba A common.lgthinq.com A 10.10.10.64
   29   1.055380   10.10.50.1 → 10.10.50.68  DNS 100 Standard query response 0x50ba A common.lgthinq.com A 10.10.10.64
   30   1.055432   10.10.50.1 → 10.10.50.68  DNS 100 Standard query response 0x50ba A common.lgthinq.com A 10.10.10.64
   31   1.055436   10.10.50.1 → 10.10.50.68  DNS 100 Standard query response 0x50ba A common.lgthinq.com A 10.10.10.64
   32   1.058619  10.10.50.68 → 10.10.10.64  TCP 64 51738 → 443 [SYN] Seq=0 Win=32120 Len=0 MSS=1460
   33   1.058626  10.10.50.68 → 10.10.10.64  TCP 64 [TCP Retransmission] 51738 → 443 [SYN] Seq=0 Win=32120 Len=0 MSS=1460
   34   1.058720  10.10.50.68 → 10.10.10.64  TCP 64 [TCP Retransmission] 51738 → 443 [SYN] Seq=0 Win=32120 Len=0 MSS=1460
   35   1.060228  10.10.10.64 → 10.10.50.68  TCP 64 443 → 51738 [SYN, ACK] Seq=0 Ack=1 Win=64860 Len=0 MSS=1410
   36   1.060234  10.10.10.64 → 10.10.50.68  TCP 64 [TCP Retransmission] 443 → 51738 [SYN, ACK] Seq=0 Ack=1 Win=64860 Len=0 MSS=1410
   37   1.060266  10.10.10.64 → 10.10.50.68  TCP 64 [TCP Retransmission] 443 → 51738 [SYN, ACK] Seq=0 Ack=1 Win=64860 Len=0 MSS=1410
   38   1.060270  10.10.10.64 → 10.10.50.68  TCP 64 [TCP Retransmission] 443 → 51738 [SYN, ACK] Seq=0 Ack=1 Win=64860 Len=0 MSS=1410
   39   1.064371  10.10.50.68 → 10.10.10.64  TCP 60 51738 → 443 [ACK] Seq=1 Ack=1 Win=32120 Len=0
   40   1.064381  10.10.50.68 → 10.10.10.64  TCP 60 [TCP Dup ACK 39#1] 51738 → 443 [ACK] Seq=1 Ack=1 Win=32120 Len=0
   41   1.064707  10.10.50.68 → 10.10.10.64  TCP 60 [TCP Dup ACK 39#2] 51738 → 443 [ACK] Seq=1 Ack=1 Win=32120 Len=0
   42   1.069404  10.10.50.68 → 10.10.10.64  TLSv1 228 Client Hello (SNI=common.lgthinq.com)
   43   1.069415  10.10.50.68 → 10.10.10.64  TCP 228 [TCP Retransmission] 51738 → 443 [PSH, ACK] Seq=1 Ack=1 Win=32120 Len=168
   44   1.069628  10.10.50.68 → 10.10.10.64  TCP 228 [TCP Retransmission] 51738 → 443 [PSH, ACK] Seq=1 Ack=1 Win=32120 Len=168
   45   1.760970 LGInnotek_44:55:66 →              ARP 48 ARP Announcement for 10.10.50.68
   46   1.760982 LGInnotek_44:55:66 →              ARP 48 ARP Announcement for 10.10.50.68
   47   1.761035 LGInnotek_44:55:66 →              ARP 48 ARP Announcement for 10.10.50.68
   48   1.761051 LGInnotek_44:55:66 →              ARP 48 ARP Announcement for 10.10.50.68
   49   1.823394  10.10.50.68 → 10.10.10.64  TCP 60 [TCP ACKed unseen segment] 51738 → 443 [RST, ACK] Seq=873 Ack=2551 Win=30845 Len=0
   50   1.823403  10.10.50.68 → 10.10.10.64  TCP 60 51738 → 443 [RST, ACK] Seq=873 Ack=2551 Win=30845 Len=0
   51   1.823507  10.10.50.68 → 10.10.10.64  TCP 60 51738 → 443 [RST, ACK] Seq=873 Ack=2551 Win=30845 Len=0
   52   1.824204  10.10.10.64 → 10.10.50.68  TLSv1.2 129 [TCP ACKed unseen segment] [TCP Previous segment not captured] , Encrypted Alert
   53   1.824211  10.10.10.64 → 10.10.50.68  TCP 129 [TCP Retransmission] 443 → 51738 [PSH, ACK] Seq=2551 Ack=873 Win=64057 Len=69
   54   1.824264  10.10.10.64 → 10.10.50.68  TCP 129 [TCP Retransmission] 443 → 51738 [PSH, ACK] Seq=2551 Ack=873 Win=64057 Len=69
   55   1.824275  10.10.10.64 → 10.10.50.68  TCP 129 [TCP Retransmission] 443 → 51738 [PSH, ACK] Seq=2551 Ack=873 Win=64057 Len=69
   56   1.856642  10.10.50.68 → 10.10.10.64  TCP 60 51738 → 443 [RST, ACK] Seq=873 Ack=2620 Win=30845 Len=0
   57   1.856653  10.10.50.68 → 10.10.10.64  TCP 60 51738 → 443 [RST, ACK] Seq=873 Ack=2620 Win=30845 Len=0
   58   1.856791  10.10.50.68 → 10.10.10.64  TCP 60 51738 → 443 [RST, ACK] Seq=873 Ack=2620 Win=30845 Len=0
   59   2.756621 LGInnotek_44:55:66 →              ARP 48 ARP Announcement for 10.10.50.68
   60   2.756633 LGInnotek_44:55:66 →              ARP 48 ARP Announcement for 10.10.50.68
   61   2.756678 LGInnotek_44:55:66 →              ARP 48 ARP Announcement for 10.10.50.68
   62   2.756698 LGInnotek_44:55:66 →              ARP 48 ARP Announcement for 10.10.50.68
   63   3.756530 LGInnotek_44:55:66 →              ARP 48 ARP Announcement for 10.10.50.68
   64   3.756540 LGInnotek_44:55:66 →              ARP 48 ARP Announcement for 10.10.50.68
   65   3.756584 LGInnotek_44:55:66 →              ARP 48 ARP Announcement for 10.10.50.68
   66   3.756602 LGInnotek_44:55:66 →              ARP 48 ARP Announcement for 10.10.50.68
   67   5.180475 77:88:99:00:aa:bb →              ARP 62 Who has 10.10.50.68? Tell 10.10.50.1
   68   5.180485 77:88:99:00:aa:bb →              ARP 62 Who has 10.10.50.68? Tell 10.10.50.1
   69   5.180529 77:88:99:00:aa:bb →              ARP 62 Who has 10.10.50.68? Tell 10.10.50.1
   70   5.180535 77:88:99:00:aa:bb →              ARP 62 Who has 10.10.50.68? Tell 10.10.50.1
   71   5.184539 LGInnotek_44:55:66 →              ARP 48 10.10.50.68 is at 11:22:33:44:55:66
   72   5.184546 LGInnotek_44:55:66 →              ARP 48 10.10.50.68 is at 11:22:33:44:55:66
   73   5.184568 LGInnotek_44:55:66 →              ARP 48 10.10.50.68 is at 11:22:33:44:55:66

```
</details>

I don't know enough about packets to know what all is happening here. But it looks like it's sending the request to `common.lgthinq.com` (like we see in the logs), getting a response, and then I don't know what (as in, "I don't understand packets enough to know what it does;" not as in "I know what it does, but not why it's doing it").

The only thing that seems a bit different from the other examples I've seen here are that when it's provisioning, and gets to the `{"type": "response", "cmd": "deviceInfo", …}` step, the `data.encrypt_val` is always `''`. I don't know if that's a red herring, or important. But figured I'd point it out.

So yeah, I'm kind of stumped. Any thoughts about what might be going on and/or what to do?

**Comment by anszom** [comment]
It appears that the device somehow aborts the connection mid-request. I can't tell why. The dump is quite confusing, and TLS encryption doesn't help. I'm quite sure that it's not a TLS certificate issue, because the request is getting delivered.

Could you share some more data. Ideally all of these:
1. full transcript from rethink-setup
2. raw pcap dump
3. TLS key log file (when starting rethink-cloud, use `node --tls-keylog=file ...`

The TLS key log would allow us to decode the encrypted packets, it could shed some light on the issue. Feel free to email me (qq at kuku.eu.org) if you don't feel like sharing these publicly.

**Comment by joneshf** [comment]
Interesting! Can you help me learn what you know? How did you look at that dump and see that the connection is aborted? If you have some other resource that walks through analyzing pcap dumps, I'd be down to read up on it. I just cant really wrap my head around this stuff from the man pages and articles I've stumbled upon.

I'll see about getting that other stuff.

**Comment by anszom** [comment]
Sorry, I don't know any good learning resources, I'm speaking from little bits of experience collected here & there.

Here's my analysis of the dump (packet numbers from the tshark output):

- first of all, most packets are repeated 3 times. Something suspicious is going on...
- 1-8: DHCP address association
- 9-24: ARP request to identify the DNS server's MAC address
- 25-31: DNS transaction
- 32-41: TCP connection setup. 
- 42-44: Initial TLS packet sent by the client. Subsequent packets would be encrypted but something must be missing here, because `rethink` logs tell us that the client had managed to send a HTTP request, yet there is no evidence of this in the dump. In fact, we don't see even the TLS handshake completing.
- 49-51: this is the suspicious part, the modem resets the connection (note the RST flag). On top of that, tshark mentions "TCP ACKed unseen segment".
- 52-55: the server keeps sending some data, tshark doesn't elaborate so I can't tell you much about it
- 56-58: and receives a RST response

**Comment by joneshf** [comment]
Sorry, I haven't forgotten about this. Some life stuff happened a bit after my last message, and it put this down on the priority list a ways. I'm still interested in getting this working. And when I get some free time, I'll try and get that `tcpdump`.

Also, thank you for explaining all of that. It's helpful to see what you're seeing.

**Comment by anszom** [comment]
Cleaning up stale issues. If you have any new information, feel free to reopen.
